<!ELEMENT listado (autor*)>
<!ELEMENT autor (nombre, empresa, teléfono)>
   <!ELEMENT nombre (#PCDATA)>
   <!ELEMENT empresa (#PCDATA)>
   <!ELEMENT teléfono (#PCDATA)>
