<?xml  version="1.0" encoding="UTF-8" standalone="no" ?>
<!DOCTYPE listado SYSTEM "02autorB.dtd">
<listado>
<autor>
   <nombre>Tanmay Patil</nombre>
   <empresa>TutorialsPoint</empresa>
   <teléfono>(011) 123-4567</teléfono>   
</autor>
<autor>
   <nombre>Tanmay Patil</nombre>
   <empresa>TutorialsPoint</empresa>
   <teléfono>(011) 123-4567</teléfono>   
</autor>
</listado>